{
  "$schema": "http://json-schema.org/draft-07/schema#",
  "$id": "dashql/app_session.json",
  "title": "SessionData",
  "description": "Version 2 session data structure (dashql-session.json)",
  "type": "object",
  "properties": {
    "formatVersion": {
      "type": "integer",
      "enum": [8],
      "description": "Session persistence format. The app migrates older versions at startup and on import, see packages/dashql-app/src/migration."
    },
    "sessionId": {
      "type": "string",
      "description": "Unique session identifier (UUID v4). This is the authoritative identity; the storage location prefix is display-only."
    },
    "sessionPath": {
      "type": "string",
      "description": "Display-only path (e.g., \"opfs://sessions/<uuid>\" or \"fs://<dir>\"). Not authoritative and may be absent on newly written sessions."
    },
    "storageType": {
      "type": "string",
      "enum": ["opfs", "native"],
      "description": "Where this session's files live. Defaults to \"opfs\" when omitted."
    },
    "nativePath": {
      "type": "string",
      "description": "Absolute directory holding this session's files when storageType is \"native\"."
    },
    "name": {
      "type": "string",
      "description": "User-supplied session name shown as the primary label in the session bar and selector. Absent (or empty) means the user never named the session, and the UI falls back to the display path."
    },
    "connections": {
      "type": "array",
      "items": {
        "$ref": "#/definitions/SessionConnection"
      },
      "description": "The connections that the scripts of the session use, in the order the scripts first use them. A session without scripts holds the connection its first script will run on. The application's internal compute database is never persisted here."
    },
    "scripts": {
      "type": "array",
      "items": {
        "$ref": "#/definitions/SessionScript"
      },
      "description": "The scripts of the session in feed order. Each entry names a file in scripts/ and the connection the script runs on. Files that are not listed are appended in natural order on load, entries without a file are dropped."
    },
    "attachments": {
      "type": "array",
      "items": {
        "$ref": "#/definitions/SessionAttachment"
      },
      "description": "The files in attachments/ in natural order. Lets a session served over HTTP be fetched without a directory listing."
    },
    "metadata": {
      "$ref": "#/definitions/SessionMetadata",
      "description": "The session metadata"
    },
    "settings": {
      "$ref": "#/definitions/SessionSettings",
      "description": "The session settings. Absent in sessions written before settings existed."
    },
    "lastModified": {
      "type": "string",
      "format": "date-time",
      "description": "When was last modified"
    },
    "lastAccessed": {
      "type": "string",
      "format": "date-time",
      "description": "When was last accessed"
    }
  },
  "required": ["formatVersion", "sessionId", "connections", "scripts", "attachments", "metadata"],
  "additionalProperties": false,
  "definitions": {
    "SessionConnection": {
      "type": "object",
      "description": "A connection referenced by the session",
      "properties": {
        "connectionId": {
          "type": "string",
          "description": "The identifier (UUID) of the referenced connection in the connections of the app manifest"
        },
        "params": {
          "$ref": "connection.json#/definitions/ConnectionParams",
          "description": "A copy of the saved connection parameters. The app manifest is the source of truth, the copy keeps the session folder self-contained."
        },
        "name": {
          "type": "string",
          "description": "The name the user gave the connection. Only exports carry it: an import names the connections that are new to the app after it, the app manifest keeps the names."
        },
        "paramsDraft": {
          "$ref": "connection.json#/definitions/ConnectionParams",
          "description": "Legacy unsaved edits, only read when migrating to global connections. Drafts are kept in the app manifest."
        }
      },
      "required": ["connectionId", "params"],
      "additionalProperties": false
    },
    "SessionScript": {
      "type": "object",
      "description": "A script of the session",
      "properties": {
        "name": {
          "type": "string",
          "description": "The file name in scripts/, e.g. \"01_extract.sql\""
        },
        "connectionId": {
          "type": "string",
          "description": "The connectionId of the connection of the session that the script is analyzed and executed with"
        }
      },
      "required": ["name", "connectionId"],
      "additionalProperties": false
    },
    "SessionAttachment": {
      "type": "object",
      "description": "An attachment of the session",
      "properties": {
        "name": {
          "type": "string",
          "description": "The file name in attachments/"
        }
      },
      "required": ["name"],
      "additionalProperties": false
    },
    "SessionOriginType": {
      "type": "string",
      "enum": ["FILE", "LOCAL", "HTTP"],
      "description": "The origin type of the session"
    },
    "SessionSettings": {
      "type": "object",
      "description": "Session settings",
      "properties": {
        "cacheQueryResults": {
          "type": "boolean",
          "description": "Whether query results are cached and reused for unchanged queries"
        }
      },
      "required": ["cacheQueryResults"],
      "additionalProperties": false
    },
    "SessionMetadata": {
      "type": "object",
      "description": "Session metadata",
      "properties": {
        "originType": {
          "$ref": "#/definitions/SessionOriginType",
          "description": "The origin type"
        },
        "originalFileName": {
          "type": "string",
          "description": "The original file name"
        },
        "originalHttpUrl": {
          "type": "string",
          "description": "The original HTTP URL"
        },
        "createdAt": {
          "type": "string",
          "format": "date-time",
          "description": "When was created"
        }
      },
      "additionalProperties": false
    }
  }
}
